{
  "assessment_id": "MINIMAL-V12",
  "contract_version": "1.2",
  "created_at": "2026-09-30T12:00:00Z",
  "lifecycle": "READY",
  "profile": {
    "id": "PROFILE-MIN",
    "version": "1.0",
    "hash": "sha256:profile-min",
    "acceptable_recovery_modes": ["FIELD_SERVICE"],
    "allowed_operational_preconditions": ["COND-POWER"],
    "requirements": [
      {
        "id": "REQ-TRUST",
        "risk_category": "TRUST_ANCHORS_AUTHORIZATION",
        "applicable_phase": ["TARGET", "TRANSITION"],
        "critical_for_verdict": true,
        "criterion": "Coverage",
        "scope_status": "IN_SCOPE",
        "rule_refs": ["RULE-TRUST"],
        "required_surface_ids": ["fw-boot"],
        "acceptable_evidence_policy": {
          "required_evidence_groups": [
            {
              "role": "PRIMARY",
              "min_satisfied": 1,
              "accepted_combinations": [
                {
                  "evidence_kind": ["DECLARATION"],
                  "source_role": ["SYSTEM_OWNER"],
                  "authority_context": ["SIMULATED"],
                  "acquisition_mode": ["DOCUMENTARY"],
                  "review_status": ["CONFIRMED"]
                }
              ]
            }
          ]
        }
      },
      {
        "id": "REQ-POWER",
        "risk_category": "UPDATE_ROLLBACK_RECOVERY",
        "applicable_phase": ["TRANSITION"],
        "critical_for_verdict": true,
        "criterion": "Interruption policy",
        "scope_status": "IN_SCOPE",
        "rule_refs": ["RULE-POWER"],
        "acceptable_evidence_policy": {
          "required_evidence_groups": [
            {
              "role": "HAZARD_OBSERVATION",
              "min_satisfied": 1,
              "accepted_combinations": [
                {
                  "evidence_kind": ["MEASUREMENT"],
                  "source_role": ["TOOL"],
                  "authority_context": ["SIMULATED"],
                  "acquisition_mode": ["EMULATED"],
                  "review_status": ["AUTOMATIC"]
                }
              ]
            },
            {
              "role": "CONDITION_CLOSURE",
              "min_satisfied": 1,
              "accepted_combinations": [
                {
                  "evidence_kind": ["DECLARATION"],
                  "source_role": ["SYSTEM_OWNER"],
                  "authority_context": ["SIMULATED"],
                  "acquisition_mode": ["DOCUMENTARY"],
                  "review_status": ["CONFIRMED"]
                }
              ]
            }
          ],
          "operational_precondition_allowed": true
        }
      },
      {
        "id": "REQ-LAYOUT",
        "risk_category": "LAYOUT_STORAGE",
        "applicable_phase": ["TARGET", "TRANSITION"],
        "critical_for_verdict": true,
        "criterion": "Capacity",
        "scope_status": "IN_SCOPE",
        "rule_refs": ["RULE-LAYOUT"],
        "acceptable_evidence_policy": {
          "required_evidence_groups": [
            {
              "role": "PRIMARY",
              "min_satisfied": 1,
              "accepted_combinations": [
                {
                  "evidence_kind": ["MEASUREMENT"],
                  "source_role": ["TOOL"],
                  "authority_context": ["SIMULATED"],
                  "acquisition_mode": ["STATIC_ANALYSIS", "STATIC_ARTIFACT"],
                  "review_status": ["AUTOMATIC"]
                }
              ]
            }
          ]
        }
      }
    ]
  },
  "platform_model": {
    "id": "PLATFORM-MIN",
    "version": "1.0",
    "hash": "sha256:platform-min",
    "declared_surface_ids": ["fw-boot", "fw-update", "recovery"],
    "components": [
      {"component_id": "bootloader", "component_type": "SECURE_BOOTLOADER", "mutability": "UPDATABLE"},
      {"component_id": "firmware", "component_type": "APPLICATION_FIRMWARE", "mutability": "UPDATABLE"},
      {"component_id": "keystore", "component_type": "TRUST_STORE", "mutability": "UPDATABLE"}
    ],
    "authorization_paths": [
      {"path_id": "fw-boot", "purpose": "FIRMWARE_BOOT", "authorization_mode": "UNKNOWN", "component_refs": ["bootloader"]}
    ],
    "recovery_modes": ["FIELD_SERVICE", "DEPOT_PHYSICAL_REFLASH"]
  },
  "deployed_state": {
    "state_id": "S0",
    "snapshot_hash": "sha256:s0",
    "components": [
      {"component_id": "bootloader", "configuration": {"sig": "ECDSA"}},
      {"component_id": "firmware", "configuration": {"sig": "ECDSA"}},
      {"component_id": "keystore", "configuration": {"profile": "CLASSICAL"}}
    ],
    "authorization_path_states": {
      "fw-boot": {"policy": "CLASSICAL_ONLY", "accepted_schemes": ["ECDSA_P256"]}
    }
  },
  "candidate_state": {
    "state_id": "S2",
    "snapshot_hash": "sha256:s2",
    "components": [
      {"component_id": "bootloader", "configuration": {"sig": "ML_DSA_87"}},
      {"component_id": "firmware", "configuration": {"sig": "ML_DSA_87"}},
      {"component_id": "keystore", "configuration": {"profile": "PQC"}}
    ],
    "authorization_path_states": {
      "fw-boot": {"policy": "PQC_ONLY", "accepted_schemes": ["ML_DSA_87"]}
    }
  },
  "allowed_change_set": {
    "modifiable_components": ["bootloader", "firmware", "keystore"],
    "allowed_actions": ["UPDATE_BOOTLOADER", "UPDATE_FIRMWARE", "UPDATE_KEYSTORE"]
  },
  "derived_effects": [
    {
      "effect_id": "DE-KEYSTORE-1",
      "effect_type": "KEYSTORE_PROFILE_UPDATE",
      "target_ref": "keystore",
      "affected_field": "configuration.profile",
      "derivation_rule_ref": "RULE-KEYSTORE-FROM-BOOTLOADER"
    },
    {
      "effect_id": "DE-AUTH-S1",
      "effect_type": "AUTHORIZATION_POLICY_UPDATE",
      "target_ref": "fw-boot",
      "affected_field": "authorization_path_states",
      "derivation_rule_ref": "RULE-AUTH-TRANSITION"
    },
    {
      "effect_id": "DE-AUTH-S2",
      "effect_type": "AUTHORIZATION_POLICY_UPDATE",
      "target_ref": "fw-boot",
      "affected_field": "authorization_path_states",
      "derivation_rule_ref": "RULE-AUTH-TRANSITION"
    }
  ],
  "transition_plan": {
    "plan_id": "PLAN-MIN",
    "version": "1.0",
    "hash": "sha256:plan-min",
    "states": [
      {
        "state_id": "S0",
        "snapshot_hash": "sha256:s0",
        "components": [
          {"component_id": "bootloader", "configuration": {"sig": "ECDSA"}},
          {"component_id": "firmware", "configuration": {"sig": "ECDSA"}},
          {"component_id": "keystore", "configuration": {"profile": "CLASSICAL"}}
        ],
        "authorization_path_states": {
          "fw-boot": {"policy": "CLASSICAL_ONLY", "accepted_schemes": ["ECDSA_P256"]}
        }
      },
      {
        "state_id": "S1",
        "snapshot_hash": "sha256:s1",
        "components": [
          {"component_id": "bootloader", "configuration": {"sig": "TRANSITIONAL"}},
          {"component_id": "firmware", "configuration": {"sig": "ECDSA"}},
          {"component_id": "keystore", "configuration": {"profile": "TRANSITIONAL"}}
        ],
        "authorization_path_states": {
          "fw-boot": {"policy": "UNKNOWN", "accepted_schemes": []}
        }
      },
      {
        "state_id": "S2",
        "snapshot_hash": "sha256:s2",
        "components": [
          {"component_id": "bootloader", "configuration": {"sig": "ML_DSA_87"}},
          {"component_id": "firmware", "configuration": {"sig": "ML_DSA_87"}},
          {"component_id": "keystore", "configuration": {"profile": "PQC"}}
        ],
        "authorization_path_states": {
          "fw-boot": {"policy": "PQC_ONLY", "accepted_schemes": ["ML_DSA_87"]}
        }
      }
    ],
    "steps": [
      {
        "step_id": "STEP-S0-S1",
        "from": "S0",
        "to": "S1",
        "actions": [
          {
            "action_id": "A1",
            "action_type": "UPDATE_BOOTLOADER",
            "component_ref": "bootloader",
            "parameters": {},
            "derived_effect_refs": ["DE-KEYSTORE-1", "DE-AUTH-S1"]
          }
        ],
        "preconditions": [
          {
            "condition_id": "COND-POWER",
            "condition_type": "OPERATIONAL_PRECONDITION",
            "requirement_id": "REQ-POWER",
            "closure_action": "Controlled power",
            "acceptance_criterion": "No interruption"
          }
        ]
      },
      {
        "step_id": "STEP-S1-S2",
        "from": "S1",
        "to": "S2",
        "actions": [
          {
            "action_id": "A2",
            "action_type": "UPDATE_FIRMWARE",
            "component_ref": "firmware",
            "parameters": {},
            "derived_effect_refs": ["DE-KEYSTORE-1", "DE-AUTH-S2"]
          },
          {
            "action_id": "A3",
            "action_type": "UPDATE_BOOTLOADER",
            "component_ref": "bootloader",
            "parameters": {},
            "derived_effect_refs": ["DE-AUTH-S2"]
          }
        ],
        "preconditions": []
      }
    ]
  },
  "invariants": [
    {"invariant_id": "INV-I2", "critical_for_verdict": true, "applicable_phase": ["TRANSITION"], "subject_type": "TRANSITION_STEP", "subject_ref": "STEP-S0-S1", "evaluator_id": "RECOVERY_MODE_ACCEPTABLE", "rule_refs": ["RULE-I2"]}
  ],
  "evidence": [],
  "coverage_assertions": [],
  "evidence_gaps": [],
  "ruleset_ref": {"id": "RULESET-MIN", "version": "1.0", "hash": "sha256:rules-min"}
}
